{
  "schema_version": "1.0",
  "submission": {
    "submitted_by": "github:hydropix",
    "submitted_at": "2026-05-09T22:00:50Z"
  },
  "environment": {
    "tbl_version": "v0.2.0",
    "prompt_version": "v1",
    "judge_id": "claude-opus-4-7-rubric-v1-reranked"
  },
  "model": {
    "provider": "poe",
    "id": "gemini-3.1-flash-lite"
  },
  "results": [
    {
      "text_id": "aurelius_meditations",
      "source_lang": "en",
      "target_lang": "zh-Hans",
      "output": "做吧，灵魂，做吧；去糟蹋、去蔑视你自己吧；然而，留给你自重的时间已所剩无几。每个人的幸福都取决于他自己，但看哪，你的生命已近终点，而你却仍不自重，竟将自己的幸福寄托在他人的灵魂与看法之中。为何这些外在发生的事，竟让你如此心烦意乱？给自己留点闲暇去学习一些美好的事物吧，停止那漫无目的的奔波与游荡。",
      "output_hash": "sha256:39d4cf7ce4a44a49d8b0fb8f025a802ab15508f5ac137120466520e5bfd04ec0",
      "translation_latency_ms": 2511,
      "scores": {
        "accuracy": 8.7,
        "fluency": 8.7,
        "style": 7.5,
        "overall": 7.0,
        "feedback": "Stoic gnomic register flattened into modern Chinese essay tone; '做吧' is colloquial for the imperative voice and '灵魂' is a literal calque for 'souls' (better: 看法). −0.3 acc, −0.5 style."
      }
    },
    {
      "text_id": "dorian_gray",
      "source_lang": "en",
      "target_lang": "zh-Hans",
      "output": "画室里弥漫着浓郁的玫瑰芬芳，当轻柔的夏风拂过花园里的树木，敞开的门扉便送进丁香那沉郁的香气，或是粉色山楂花那更为清雅的幽香。亨利·沃顿勋爵斜倚在波斯鞍袋做成的长榻一角，正像往常一样抽着数不清的香烟，他隐约能瞥见金链花那蜜甜而又蜜色的花朵在闪烁。",
      "output_hash": "sha256:e9e263cf08c5154c4677185fe1666980a1082ef8dca6ff937c37726d73f8e03f",
      "translation_latency_ms": 1800,
      "scores": {
        "accuracy": 9.0,
        "fluency": 8.5,
        "style": 8.5,
        "overall": 7.9,
        "feedback": "Botanical/material accuracy excellent: 山楂花 (hawthorn), 鞍袋 (saddle-bag), 金链花 (laburnum) all correct. Compound '蜜甜而又蜜色' slightly clunky for 'honey-sweet and honey-coloured'. −0.5 fluency."
      }
    },
    {
      "text_id": "einstein_relativity",
      "source_lang": "en",
      "target_lang": "zh-Hans",
      "output": "在相对论出现之前，物理学中一直默认时间具有绝对意义，即时间独立于参考体的运动状态。但我们刚刚已经看到，这一假设与最自然的“同时性”定义是不相容的；如果我们抛弃这一假设，那么真空光速传播定律与相对性原理（在第七节中阐述）之间的矛盾便会消失。",
      "output_hash": "sha256:86be2be13066ba11ddee172ce5be79c520b207e176f0d268f2bccb166b3fef90",
      "translation_latency_ms": 1485,
      "scores": {
        "accuracy": 8.7,
        "fluency": 9.0,
        "style": 8.5,
        "overall": 8.6,
        "feedback": "Standard Chinese physics terminology (真空, 同时性, 参考体). 'Statement of time' compressed to '时间' — slight semantic drift on the technical phrasing. −0.3 acc."
      }
    },
    {
      "text_id": "emerson_self_reliance",
      "source_lang": "en",
      "target_lang": "zh-Hans",
      "output": "相信你自己：每一颗心都随着那根铁弦而震动。接受天意为你安排的位置，接受你同时代人的社会，接受事件的关联。伟人总是这样做，他们像孩子般信赖时代的精神，流露出他们的一种觉知：那绝对值得信赖的力量就驻扎在他们心中，通过他们的双手在运作，主宰着他们的整个生命。",
      "output_hash": "sha256:160b2c3e56550219412c8a30f843a0db5b7142df823cfecce02fdedd5d5f347d",
      "translation_latency_ms": 1698,
      "scores": {
        "accuracy": 8.5,
        "fluency": 8.5,
        "style": 7.5,
        "overall": 7.0,
        "feedback": "'Genius of their age' rendered as '时代的精神' loses the personification central to Emerson's romantic imagery. Gnomic imperative tone flattened. −0.5 acc, −0.5 style."
      }
    },
    {
      "text_id": "moby_dick",
      "source_lang": "en",
      "target_lang": "zh-Hans",
      "output": "叫我以实玛利吧。几年前——具体多久就不必细说了——我口袋里没几个钱，岸上也没什么特别让我感兴趣的事，于是我想，不如出海去转转，看看这世界的汪洋大海。这是我排遣忧郁、调节血液循环的一种方式。每当我发现自己嘴角下垂，面露愠色；每当我灵魂深处阴雨连绵，如同十一月的湿冷天气时，我就觉得是时候尽快出海了。",
      "output_hash": "sha256:0e93a03ba691ad6914736b2164b8e8e5326d5695a690539d12f23db10ac7f195",
      "translation_latency_ms": 2008,
      "scores": {
        "accuracy": 9.0,
        "fluency": 8.7,
        "style": 8.0,
        "overall": 7.4,
        "feedback": "Metaphors well-rendered ('damp drizzly November in my soul' → '灵魂深处阴雨连绵' captures the mood). Melville's archaic narrative cadence flattened to modern Chinese narrative. −0.5 style."
      }
    },
    {
      "text_id": "origin_species",
      "source_lang": "en",
      "target_lang": "zh-Hans",
      "output": "我现今发表的这部摘要，必然是不完善的。在此，我无法为我的各项陈述一一列出参考文献和权威依据；我只能恳请读者对我的准确性给予一定的信任。毫无疑问，书中难免会有疏漏之处，但我希望自己始终保持审慎，仅采信可靠的权威资料。在此，我只能给出我所达成的总体结论，并辅以少量事实作为例证，但我希望在大多数情况下，这些已然足够。",
      "output_hash": "sha256:c768311f9e209d0c16ac495df2e34e9a3b9b633416e2ca0934628b271319db31",
      "translation_latency_ms": 1769,
      "scores": {
        "accuracy": 9.0,
        "fluency": 8.7,
        "style": 8.5,
        "overall": 7.1,
        "feedback": "All Darwin's epistemic hedging preserved (毫无疑问, 我希望, 恳请). Solid 19th-c. scientific Chinese register."
      }
    },
    {
      "text_id": "pride_prejudice",
      "source_lang": "en",
      "target_lang": "zh-Hans",
      "output": "凡是有钱的单身汉，总想娶位太太，这已经成了一条举世公认的真理。这样的单身汉，每逢新搬到一个地方，四邻八舍的人家尽管对他的一概心思或看法一无所知，却往往把这条真理奉为圭臬，因此，他一出现，就被视为当地某位女儿理所当然的囊中之物。",
      "output_hash": "sha256:7ea628366ce2f9c820592a51da1760494c4f67998414a59f687c6231764e21af",
      "translation_latency_ms": 1917,
      "scores": {
        "accuracy": 8.7,
        "fluency": 9.0,
        "style": 8.5,
        "overall": 8.6,
        "feedback": "Famous opening rendered with Austen's irony intact ('囊中之物' is a vivid match for 'rightful property'). 'First entering a neighbourhood' compressed to '一出现' loses some specificity. −0.3 acc."
      }
    },
    {
      "text_id": "study_scarlet",
      "source_lang": "en",
      "target_lang": "zh-Hans",
      "output": "“我看得出，你去过阿富汗。”\n“你到底是怎么知道的？”我惊讶地问。\n“这不重要，”他独自轻笑了一声，说道，“现在的问题是关于血红蛋白。毫无疑问，你明白我这项发现的意义吧？”\n“从化学角度来看，这确实很有趣，”我回答道，“但从实用角度……”\n“哎呀，伙计，这是多年来法医学上最实用的发现。难道你看不出来吗？它为我们提供了一种鉴定血迹的万无一失的方法。”",
      "output_hash": "sha256:3b4b93f9c9dfbad0d24ee0c7a5de03f74032068dc6ba2740d6e20860188362f3",
      "translation_latency_ms": 1829,
      "scores": {
        "accuracy": 9.0,
        "fluency": 9.0,
        "style": 8.5,
        "overall": 8.6,
        "feedback": "Dialogue flows naturally with proper Chinese punctuation. 法医学 and 万无一失 are idiomatic. Holmes's clipped voice preserved."
      }
    },
    {
      "text_id": "twain_innocents",
      "source_lang": "en",
      "target_lang": "zh-Hans",
      "output": "在我看来，每当我沾沾自喜，以为自己终于发现了一幅既美妙又值得称赞的古画时，这种快乐本身就是一种确凿无疑的证明，证明它绝非什么佳作，也根本不值得赞美。在威尼斯，这样的事我已经记不清发生过多少次了。每一次，导游都会用一句“这没什么——这是文艺复兴时期的作品”来浇灭我那高涨的热情。",
      "output_hash": "sha256:da022baca82eaa439fcff3573d9689388239023aab0717e25e5b77b8abf5595e",
      "translation_latency_ms": 1688,
      "scores": {
        "accuracy": 9.0,
        "fluency": 9.0,
        "style": 8.3,
        "overall": 8.5,
        "feedback": "Twain's mock-naive irony kept ('沾沾自喜', '确凿无疑'). Punchline 'It is of the Renaissance' clean. Slight register flattening. −0.3 style."
      }
    },
    {
      "text_id": "walden",
      "source_lang": "en",
      "target_lang": "zh-Hans",
      "output": "我步入丛林，因为我希望从容不迫地生活，只面对生命中最本质的事实，看看我是否能学到它所要教导的一切，而不至于在临终时才发现自己虚度了光阴。我不想过那种非生活的生活，生命如此宝贵；除非万不得已，我也不想去练习顺从。我想要活得深刻，吸尽生命的精髓。",
      "output_hash": "sha256:8ef1eded9001ab0e5a0d0c17a952f96b061f8a3cd55f4e094ce91344a865d5b3",
      "translation_latency_ms": 1718,
      "scores": {
        "accuracy": 9.0,
        "fluency": 9.0,
        "style": 8.5,
        "overall": 8.5,
        "feedback": "'Suck out all the marrow' → '吸尽生命的精髓' preserves the visceral metaphor. Contemplative tone reads naturally."
      }
    },
    {
      "text_id": "aurelius_meditations",
      "source_lang": "en",
      "target_lang": "es",
      "output": "Hazlo, alma mía, hazlo; abusa y desprecia de ti misma; pues pronto llegará el momento en que ya no podrás respetarte. La felicidad de cada hombre depende de sí mismo, pero mira, tu vida está casi acabada y, mientras no te otorgas ningún respeto, haces que tu felicidad dependa de las almas y las opiniones de los demás. ¿Por qué debería distraerte tanto cualquiera de estas cosas que suceden externamente? Date tiempo para aprender algo bueno y deja de vagar y errar de un lado a otro.",
      "output_hash": "sha256:63d498aeb8d64a3aa38b2b02f24f8a0a64306484f73a34db66fec1a24761466c",
      "translation_latency_ms": 1694,
      "scores": {
        "accuracy": 9.0,
        "fluency": 7.5,
        "style": 7.5,
        "overall": 7.8,
        "feedback": "Grammar error: 'desprecia de ti misma' is incorrect (despreciar is transitive, no 'de'); should be 'despréciate'. Stoic gnomic register slightly flattened. −1.0 fluency, −0.5 style."
      }
    },
    {
      "text_id": "dorian_gray",
      "source_lang": "en",
      "target_lang": "es",
      "output": "El estudio estaba lleno del rico aroma de las rosas, y cuando el ligero viento veraniego se agitaba entre los árboles del jardín, llegaba a través de la puerta abierta el intenso perfume de las lilas o el aroma más delicado de los espinos rosados. Desde el rincón del diván de alforjas persas en el que estaba tumbado, fumando, como era su costumbre, innumerables cigarrillos, Lord Henry Wotton apenas podía vislumbrar el brillo de las flores de laburno, dulces como la miel y del color de la miel.",
      "output_hash": "sha256:f284807cf8235c7730ff8d050cc4cebf4df0783bbade52b8f7bbb6dc35170297",
      "translation_latency_ms": 1671,
      "scores": {
        "accuracy": 9.0,
        "fluency": 9.0,
        "style": 8.5,
        "overall": 7.9,
        "feedback": "Botanical/material lexicon excellent: alforjas persas, espinos rosados, laburno all correct. Wilde's ornate prose preserved with minimal loss."
      }
    },
    {
      "text_id": "einstein_relativity",
      "source_lang": "en",
      "target_lang": "es",